{
  "pressure": 150,
  "warning": "The indicator turns amber. A second bell is gathering in the iron.",
  "critical": "A figure stands inside the fog. The shelter is still open.",
  "retreat": "You step behind the stone recess. Something crosses where you were standing. It never enters the marked shelter."
}
