{
  "pressure": 135,
  "warning": "Water reaches the first red mark on the shelf legs.",
  "critical": "The far shelf tilts. The raised exit is still clear.",
  "retreat": "You return to the raised index desk. The pump’s reserve tank drains the nearest aisle; essential records remain in their protective cases."
}
