{
  "pressure": 155,
  "warning": "The first bank of fluorescent tubes goes dark.",
  "critical": "The announcement loses its words. Only the shape of your name remains.",
  "retreat": "The service cabinet has a manual isolation switch. You turn it off and wait in the daylight panel by the door."
}
